{
  "schemaVersion": "4.0",
  "id": "integrated-robotic-handling",
  "version": "1.7",
  "title": "Integrated robotic handling system design",
  "summary": "A fixed-base manipulator and powered mechanical gripper design for a three-workpiece machine-tending cell, authored as a one-year-forward engineering benchmark.",
  "taskDefinitionDigest": "dac7a67f432b105897fbfb8f7290901ca27e4cab14a686cf5df24275184f4a01",
  "authorId": "rotorbench-engineering-benchmark",
  "instructions": {
    "path": "TASK.md",
    "mediaType": "text/markdown",
    "downloadName": "TASK.md",
    "sha256": "efd8293894c3546c990a10d4618632e53efc15189019a592209ebcc813493d5f",
    "sizeBytes": 8246
  },
  "inputs": [
    {
      "id": "requirements",
      "path": "inputs/requirements.json",
      "mediaType": "application/json",
      "provenance": "Benchmark-author requirement baseline v1.0; every requirement is traceable by REQ ID.",
      "license": "CC-BY-4.0",
      "downloadName": "requirements.json",
      "sha256": "5a9cbab00237de0d071c852546a4f48c8ea9481ffbb272f03ad999de33fa787f",
      "sizeBytes": 14407
    },
    {
      "id": "cell-layout",
      "path": "inputs/cell-layout.json",
      "mediaType": "application/json",
      "provenance": "Benchmark-owned synthetic cell geometry; coordinates are in mm in the world frame declared in the file.",
      "license": "CC-BY-4.0",
      "downloadName": "cell-layout.json",
      "sha256": "1bff3dc60daa210a4c791c8e7bccb76b647604c9b7668efdc15bbfd6995355b6",
      "sizeBytes": 7544
    },
    {
      "id": "fixed-geometry",
      "path": "inputs/fixed-geometry.json",
      "mediaType": "application/json",
      "provenance": "Benchmark-owned exact neutral CSG/interface definition for every evaluator-relevant fixed cell object, workpiece, and grasp region.",
      "license": "CC-BY-4.0",
      "downloadName": "fixed-geometry.json",
      "sha256": "2d4b9c96605f32d26845517fc316ace0f487357db49a834d51b5f4ae1e442267",
      "sizeBytes": 11587
    },
    {
      "id": "grasp-surface-validator",
      "path": "inputs/grasp-surface-validator.mjs",
      "mediaType": "text/javascript",
      "provenance": "Hash-bound benchmark-owned static checker for fixed planar grasp-surface CSG exposure and coordinate parameterization.",
      "license": "CC-BY-4.0",
      "downloadName": "grasp-surface-validator.mjs",
      "sha256": "5534790861c03b53166ac77deaa7186997bc5d732933f68a4490c3c24513005d",
      "sizeBytes": 6708
    },
    {
      "id": "workpieces",
      "path": "inputs/workpieces.json",
      "mediaType": "application/json",
      "provenance": "Benchmark-owned representative manufacturing workpieces; dimensions and contact data are fixed design inputs, with non-physical uncertainty explicitly recorded.",
      "license": "CC-BY-4.0",
      "downloadName": "workpieces.json",
      "sha256": "eddd40d6badf8c712eadad763aa033130f38c3384cc5243b14e0cb803808afbc",
      "sizeBytes": 8994
    },
    {
      "id": "interface-dimensions",
      "path": "inputs/interface-dimensions.json",
      "mediaType": "application/json",
      "provenance": "Benchmark-owned mechanical interface definition derived from industrial machine-tending conventions.",
      "license": "CC-BY-4.0",
      "downloadName": "interface-dimensions.json",
      "sha256": "4811e629093c5ded7c92c3211e9ecd2c3f16259fdce374cc2470903d6bf83fa7",
      "sizeBytes": 6599
    },
    {
      "id": "component-catalog",
      "path": "inputs/component-catalog-snapshot.json",
      "mediaType": "application/json",
      "provenance": "Benchmark-owned neutral component catalogue snapshot; values are fixed benchmark design inputs with source class, applicability, and uncertainty recorded in calibration provenance.",
      "license": "CC-BY-4.0",
      "downloadName": "component-catalog-snapshot.json",
      "sha256": "8083be7703aef6d373f2ec1b57dfe0e4dfbbe3c1c275e7101199064f6afaf482",
      "sizeBytes": 19336
    },
    {
      "id": "component-interface-cards",
      "path": "inputs/component-interface-cards.json",
      "mediaType": "application/json",
      "provenance": "Benchmark-owned closed-catalogue mounting, envelope, interface, centre-of-mass, inertia, and service cards.",
      "license": "CC-BY-4.0",
      "downloadName": "component-interface-cards.json",
      "sha256": "5d6b4bf46068ab960e057ebbb50653263c87e16a1bfbf4166b1515ee28fd31c8",
      "sizeBytes": 11676
    },
    {
      "id": "calibration-provenance",
      "path": "inputs/calibration-provenance.json",
      "mediaType": "application/json",
      "provenance": "Authoring provenance and uncertainty record for quantitative baseline values.",
      "license": "CC-BY-4.0",
      "downloadName": "calibration-provenance.json",
      "sha256": "1cdc339e8c8554276599fbfe9ce99aa85473717318d02cd3a23951034b7132be",
      "sizeBytes": 15298
    },
    {
      "id": "evaluation-commitments",
      "path": "inputs/evaluation-commitments.json",
      "mediaType": "application/json",
      "provenance": "Public evaluator commitments. Hidden instances are represented only by commitment, never by concealed requirements in this contract.",
      "license": "CC-BY-4.0",
      "downloadName": "evaluation-commitments.json",
      "sha256": "ea7b1c56f6a4c7bf2473de211ee4e7ed0fa6b19c90eae19afa1bd0e02171a8a8",
      "sizeBytes": 6783
    },
    {
      "id": "output-contract",
      "path": "inputs/output-contract.json",
      "mediaType": "application/json",
      "provenance": "Benchmark-owned neutral output and evidence contract.",
      "license": "CC-BY-4.0",
      "downloadName": "output-contract.json",
      "sha256": "0f259a26e73cdf1f3848cb810f02edb59fafb0302e0e7c250c33012adde5497e",
      "sizeBytes": 12503
    },
    {
      "id": "neutral-handoff-contract",
      "path": "inputs/neutral-handoff-contract.json",
      "mediaType": "application/json",
      "provenance": "Benchmark-owned deterministic static STEP/kinematics contract, scope, limits, and calibration-coverage boundary.",
      "license": "CC-BY-4.0",
      "downloadName": "neutral-handoff-contract.json",
      "sha256": "785b1d4564b36a12d720d491e41127cd043aa4cbc6205b3f9ce9151a67cee749",
      "sizeBytes": 8528
    },
    {
      "id": "neutral-handoff-validator",
      "path": "inputs/neutral-handoff-validator.mjs",
      "mediaType": "text/javascript",
      "provenance": "Hash-bound benchmark-owned evaluator tool. It reads static candidate artefacts only, performs no network access, and never imports or executes candidate code.",
      "license": "CC-BY-4.0",
      "downloadName": "neutral-handoff-validator.mjs",
      "sha256": "af9b60bfeb1db396bf8a742992cbf94c337242285fdef1141378e6048e52a856",
      "sizeBytes": 23556
    },
    {
      "id": "common-evaluation-method",
      "path": "inputs/common-evaluation-method.json",
      "mediaType": "application/json",
      "provenance": "Frozen common evidence-only method and calibration boundary for cycle, collision, and accuracy assessment across architectures.",
      "license": "CC-BY-4.0",
      "downloadName": "common-evaluation-method.json",
      "sha256": "a906d25e3cd4e963035b1ff86fe7836a1467fcabb57ab70ee8269c69ae59ae41",
      "sizeBytes": 7509
    },
    {
      "id": "instance-bank-commitment",
      "path": "inputs/instance-bank-commitment.json",
      "mediaType": "application/json",
      "provenance": "Public fixed-anchor baseline instance manifest; the complete candidate-visible baseline is hash-bound in this packet before a run begins.",
      "license": "CC-BY-4.0",
      "downloadName": "instance-bank-commitment.json",
      "sha256": "85196a85d5092135c357276fab7ba43b9c206ab0c698e00975ca4e731f2dce26",
      "sizeBytes": 1275
    },
    {
      "id": "change-event-commitment",
      "path": "inputs/change-event-commitment.json",
      "mediaType": "application/json",
      "provenance": "Public commitment to the event-private change payload; the payload remains separately sealed until its defined disclosure point.",
      "license": "CC-BY-4.0",
      "downloadName": "change-event-commitment.json",
      "sha256": "2ea63470d48f36949c92ee77409e10836322045f7130d9c05c5e3d9000d1199f",
      "sizeBytes": 1617
    },
    {
      "id": "sanitization-profile",
      "path": "inputs/sanitization-profile.json",
      "mediaType": "application/json",
      "provenance": "Public candidate-artifact safety boundary; the corresponding enforcement profile is hash-bound at packet freeze.",
      "license": "CC-BY-4.0",
      "downloadName": "sanitization-profile.json",
      "sha256": "a6a822d1dcacf3a04a3b977cc228da65bc5d381e2b3afc3150a0074dfcb36ca6",
      "sizeBytes": 1376
    },
    {
      "id": "disclosure-schedule",
      "path": "inputs/disclosure-schedule.json",
      "mediaType": "application/json",
      "provenance": "Public disclosure and embargo commitment.",
      "license": "CC-BY-4.0",
      "downloadName": "disclosure-schedule.json",
      "sha256": "b60be0ebb662bb256128fda7918100031d233f3957c61cd999267a1f4d70f9b3",
      "sizeBytes": 1293
    },
    {
      "id": "scoring-contract",
      "path": "inputs/scoring-contract.json",
      "mediaType": "application/json",
      "provenance": "Byte-identical public scoring contract copied from evaluation/integrated-robotic-handling-v1/scoring-contract.json and hash-bound in this task contract.",
      "license": "CC-BY-4.0",
      "downloadName": "scoring-contract.json",
      "sha256": "d4bfa4a46f4daa0c0b1dd02080509e31fc6c8d8081a5b940095d44294857cca9",
      "sizeBytes": 13857
    }
  ],
  "requiredOutputs": [
    {
      "id": "OUT-001",
      "role": "cad-source",
      "description": "Native or reproducible parametric CAD source for the complete integrated system, with an assembly manifest."
    },
    {
      "id": "OUT-002",
      "role": "step",
      "description": "Neutral STEP AP242 assembly export containing the complete candidate-designed mechanical system and declared purchased components."
    },
    {